Id,Name,EffectTypeName,Desc
905002,結束のクリスタルLv{Param1},結束のクリスタルLv{Param1}強化効果,アジトの結束のクリスタルの力が与えられる
905003,結束のクリスタルLv{Param1},結束のクリスタルLv{Param1}強化効果,アジトの結束のクリスタルの力が与えられる
905004,結束のクリスタルLv{Param1},結束のクリスタルLv{Param1}強化効果,アジトの結束のクリスタルの力が与えられる
905005,結束のクリスタルLv{Param1},結束のクリスタルLv{Param1}強化効果,アジトの結束のクリスタルの力が与えられる
905006,結束のクリスタルLv{Param1},結束のクリスタルLv{Param1}強化効果,アジトの結束のクリスタルの力が与えられる
905007,結束のクリスタルLv{Param1},結束のクリスタルLv{Param1}強化効果,アジトの結束のクリスタルの力が与えられる
905008,結束のクリスタルLv{Param1},結束のクリスタルLv{Param1}強化効果,アジトの結束のクリスタルの力が与えられる
905009,結束のクリスタルLv{Param1},結束のクリスタルLv{Param1}強化効果,アジトの結束のクリスタルの力が与えられる
905010,結束のクリスタルLv{Param1},結束のクリスタルLv{Param1}強化効果,アジトの結束のクリスタルの力が与えられる
905101,晩餐（小）の満腹感,物理、魔法防御力の増加,物理/魔法防御力が500増加
905102,晩餐（中）の満腹感,HP、MP増加,"HP/MPが1,000増加"
905103,晩餐（大）の満腹感,物理、魔法攻撃力の増加,物理/魔法攻撃力が500増加
905104,高級晩餐（小）の満腹感,物理、魔法防御力の増加,"物理/魔法防御力が1,200増加"
905105,高級晩餐（中）の満腹感,HP、MP増加,"HP/MPが2,000増加"
905106,高級晩餐（大）の満腹感,物理、魔法攻撃力の増加,"物理/魔法攻撃力が1,200増加"
905107,最高級晩餐（小）の満腹感,物理、魔法攻撃力、クリティカル増加,"物理/魔法防御力が2,000、クリティカルが500増加"
905108,最高級晩餐（中）の満腹感,HP、MP、クリティカル増加,"HP/MPが3,000、クリティカルが500増加"
905109,最高級晩餐（大）の満腹感,物理、魔法攻撃力、クリティカル増加,"物理/魔法攻撃力が2,000、クリティカルが500増加"
905501,物理攻撃力増加ポーション,物理攻撃力増加,物理攻撃力が10%増加
905502,魔法攻撃力増加ポーション,魔法攻撃力増加,魔法攻撃力が10%増加
905503,物理防御力増加ポーション,物理防御力増加,物理防御力が10%増加
905504,魔法防御力増加ポーション,魔法防御力増加,魔法防御力が10%増加
905505,移動速度増加ポーション,移動速度増加,移動速度が15%増加
905506,採集速度増加ポーション,採集速度増加,採集速度が50%増加
905507,攻撃速度増加ポーション,攻撃速度増加,攻撃速度が20%増加
905508,回避率増加ポーション,回避率増加,回避率が50%増加
905509,弾力増加ポーション,弾力増加,"弾力が10,000増加"
905510,防御無視ダメージ増加ポーション,防御無視ダメージ増加,"防御無視ダメージが2,000増加"
905511,固定ダメージ減少増加ポーション,固定ダメージ減少増加,"固定ダメージ減少が1,000増加"
905512,スキルクールタイム短縮ポーション,スキルクールタイム短縮,スキルクールタイムが30%短縮
905513,貫通増加ポーション,貫通力増加,"貫通力が10,000増加"
905514,ボスに与えるダメージ増加ポーション,ボスに与えるダメージ増加,ボスに与えるダメージが15%増加
905515,ボスから受けるダメージ減少ポーション,ボスから受けるダメージ減少,ボスから受けるダメージが5%減少
905516,モンスターコア獲得増加ポーション,モンスターコア獲得増加,モンスターコアの獲得率が25%増加（エリートダンジョンを除く）
905601,士気高揚ポーション,士気高揚,自分を含む周りの血盟員の移動速度が30%増加
905602,士気高揚効果,士気高揚効果,血盟員の移動速度が30%増加
905603,氷の嵐ポーション,氷の嵐,周りにいる敵の移動速度が50%減少
905604,氷の嵐効果,氷の嵐効果,移動速度が50%減少
905605,攻城破壊ポーション,攻城破壊,攻城のオブジェクトに与えるダメージが50%増加
905606,HP回復量増加ポーション,HP回復量増加,自分を含む周りの血盟員のHP回復量が50%増加
905607,HP回復量増加効果,HP回復量増加効果,血盟員のHP回復量が50%増加
905608,攻撃力狂化ポーション,攻撃力狂化,自分の防御力が60%減少し、攻撃力が20%増加
905609,防御力狂化ポーション,防御力狂化,自分の攻撃力が15%減少し、防御力が100%増加
905610,精神強化ポーション,精神強化,状態異常抵抗率が50%増加
905611,MP消滅ポーション,MP消滅,周りにいる敵のMPが1秒毎に20%減少
905612,MP消滅効果,MP消滅,MPが1秒毎に20%減少
906000,名誉の戦場の復活保護,名誉の戦場の復活保護,ダメージを受けず、敵を攻撃すると無敵状態が解除される
906001,名誉の戦場,HP回復,味方のHPが回復
906002,名誉の戦場,HP回復効果,味方のHPが回復
906003,名誉の戦場,移動速度増加,味方の移動速度が増加
906100,勇猛の戦場の復活保護,勇猛の戦場の復活保護,ダメージを受けず、敵を攻撃すると無敵状態が解除される
906101,勇猛の戦場,HP回復,HPが回復
906102,勇猛の戦場,移動速度増加,移動速度が増加
906500,闘技場復活保護強化効果,闘技場復活保護強化効果,ダメージを受けず、敵を攻撃すると無敵状態が解除される
906501,闘技場の聖域,闘技場の聖域,攻撃力、防御力、攻撃速度、移動速度が30%増加
11,ソウルショット,ソウルショット,ソウルショット
12,ノックバックテスト用,ノックダウン,ノックバックテスト用
100001,無敵強化効果,無敵,無敵強化効果
100002,透明強化効果,透明,透明強化効果
100003,ストロング強化効果,ストロング,ストロング強化効果
100004,スマート強化効果,スマート,スマート強化効果
100005,一撃必殺強化効果,一撃必殺,一撃必殺強化効果
100006,大地のオーラ,攻撃力増加,物理、魔法攻撃力が10%増加
100007,風のオーラ,攻撃力増加,物理、魔法攻撃力が10%増加
100008,祭壇の加護,攻撃力増加,祭壇の力が増加し、物理、魔法攻撃力が30%増加
100011,コンボ効果Lv{Param1},コンボ{Param2},10コンボ強化効果、アイコン表示X
100012,コンボ効果Lv{Param1},コンボ{Param2},20コンボ強化効果、アイコン表示X
100013,コンボ効果Lv{Param1},コンボ{Param2},40コンボ強化効果、アイコン表示X
100014,コンボ効果Lv{Param1},コンボ{Param2},60コンボ強化効果、アイコン表示X
100015,コンボ効果Lv{Param1},コンボ{Param2},90コンボ強化効果、アイコン表示X
100016,コンボ効果Lv{Param1},コンボ{Param2},120コンボ強化効果、アイコン表示X
100017,コンボ効果Lv{Param1},コンボ{Param2},160コンボ強化効果、アイコン表示X
100018,コンボ効果Lv{Param1},コンボ{Param2},200コンボ強化効果、アイコン表示X
100019,コンボ効果Lv{Param1},コンボ{Param2},250コンボ強化効果、アイコン表示X
100020,コンボ効果Lv{Param1},コンボ{Param2},300コンボ強化効果、アイコン表示X
100021,良心の呵責,攻撃力、防御力減少,良心の呵責が大きくなり、力が弱まる
100031,PVP補正強化効果,攻撃力、防御力増加,良心の呵責が大きくなり、力が弱まる
200000,保護,保護,無敵強化効果
200001,炎のオーラ,移動速度、攻撃速度増加,移動速度と攻撃速度が10%増加
200002,水のオーラ,移動速度増加、スキルクールタイム短縮,移動速度が10%増加し、スキルクールタイムが15％短縮
200003,攻城英雄Lv{Param1},攻撃力、防御力増加{Param1},攻撃力、防御力が1%増加
200004,攻城英雄Lv{Param1},攻撃力、防御力増加{Param1},攻撃力、防御力が2%増加
200005,攻城英雄Lv{Param1},攻撃力、防御力増加{Param1},攻撃力、防御力が3%増加
200006,攻城英雄Lv{Param1},攻撃力、防御力増加{Param1},攻撃力、防御力が4%増加
200007,攻城英雄Lv{Param1},攻撃力、防御力増加{Param1},攻撃力、防御力が5%増加
200008,攻城英雄Lv{Param1},攻撃力、防御力増加{Param1},攻撃力、防御力が6%増加
200009,攻城英雄Lv{Param1},攻撃力、防御力増加{Param1},攻撃力、防御力が7%増加
300001,城の威厳,経験値獲得増加,"モンスターの討伐で獲得する経験値が50%増加
占領した城の領地でのみ適用"
300002,グルーディオ城,攻撃力、防御力が1.5%増加,攻撃力、防御力が1.5%増加（攻城戦、要塞戦を除く）
300003,ディオン城,攻撃力、防御力が2%増加,攻撃力、防御力が2%増加（攻城戦、要塞戦を除く）
300004,ギラン城,攻撃力、防御力が2.5%増加,攻撃力、防御力が2.5%増加（攻城戦、要塞戦を除く）
300005,オーレン城,攻撃力、防御力が3%増加,攻撃力、防御力が3%増加（攻城戦、要塞戦を除く）
301001,要塞の祝福,モンスターコア獲得確率増加,"モンスターコアの獲得確率が50%増加
占領した要塞のエリアでのみ適用"
301002,グルーディン街道の要塞,ノーマルモンスターに与えるダメージが増加,ノーマルモンスターに与えるダメージが5％増加
301003,グルーディン街道の要塞,ノーマルモンスターから受けるダメージが減少,ノーマルモンスターから受けるダメージが2％減少
301004,ウィンダウッド荘園の要塞,ノーマルモンスターに与えるダメージが増加,ノーマルモンスターに与えるダメージが10％増加
301005,荒地の要塞,ノーマルモンスターから受けるダメージが減少,ノーマルモンスターから受けるダメージが4％減少
301006,ディオン牧草地の要塞,エリートモンスターに与えるダメージが増加,エリートモンスターに与えるダメージが5％増加
301007,クルマ湿地の要塞,エリートモンスターから受けるダメージが減少,エリートモンスターから受けるダメージが2％減少
301008,闘争の峰の要塞,エリートモンスターに与えるダメージが増加,エリートモンスターに与えるダメージが10％増加
301009,絶叫の地の要塞,エリートモンスターから受けるダメージが減少,エリートモンスターから受けるダメージが4％減少
301010,ギラン自治領の要塞,ボスモンスターに与えるダメージが増加,ボスモンスターに与えるダメージが5％増加
301011,死霧の海岸の要塞,ボスモンスターから受けるダメージが減少,ボスモンスターから受けるダメージが2％減少
301012,悪魔の島の要塞,ボスモンスターに与えるダメージが増加,ボスモンスターに与えるダメージが10％増加
301013,死の沿道の要塞,ボスモンスターから受けるダメージが減少,ボスモンスターから受けるダメージが4％減少
301014,ドラゴンバレーの要塞,プレイヤーに与えるダメージが増加,"プレイヤーに与えるダメージが2％増加
（攻城戦、要塞戦を除く）"
301015,北風の高原の要塞,プレイヤーから受けるダメージが減少,"プレイヤーから受けるダメージが2％減少
（攻城戦、要塞戦を除く）"
301016,時が止まった地の要塞,プレイヤーに与えるダメージが増加,"プレイヤーに与えるダメージが4％増加
（攻城戦、要塞戦を除く）"
301017,象牙の塔自治区の要塞,プレイヤーから受けるダメージが減少,"プレイヤーから受けるダメージが4％減少
（攻城戦、要塞戦を除く）"
301018,話せる島の要塞,移動速度増加,"移動速度が2.5%増加
（攻城戦、要塞戦を除く）"
302001,君主の知恵,HP、MPポーション回復量増加,HP、MPポーションの回復量が20%増加（攻城戦、要塞戦を除く）
302002,君主の栄光,モンスター討伐で獲得する経験値の獲得量、コアの獲得確率が増加,モンスター討伐で獲得する経験値の獲得量、コアの獲得確率が20%増加
302003,君主の恵み,モンスター討伐で獲得するアイテムの獲得確率、アデナの獲得量が増加,モンスター討伐で獲得するアデナの獲得量、アイテムの獲得確率が20%増加
400001,聖域強化効果,アデナ、経験値の獲得量及び移動速度が増加,ゴールド、経験値の獲得量及び移動速度が増加
400002,グランカインの怒り,攻撃力、防御力、攻撃速度増加,攻撃力、防御力、攻撃速度増加
500001,エルドリュの怒り,攻撃力、防御力、移動速度、攻撃速度が増加,"弱い敵に対する怒りの表出/攻撃力、防御力が2倍&移動速度,攻撃速度が一定量増加"
510001,デイリーダイヤボーナス強化効果,移動速度増加,移動速度が8%増加
900001,傲慢の塔ボスの強調用,強い,強い
301,ラーテルロバストの祝福{Param1},移動速度,ラーテルロバストの祝福で移動速度が増加
302,ラーテルロバストの祝福{Param1},採集速度,ラーテルロバストの祝福で採集速度が増加
303,ラーテルロバストの祝福{Param1},採集量,ラーテルロバストの祝福で採集量が増加
304,庭園の守護者の祝福,庭園の守護者強化効果,庭園の守護者からの祝福で採集量が2倍に増加
305,庭園の守護者,庭園の守護者,庭園の守護者が初出現時に使用するスキル
306,庭園の守護者のエフェクト,庭園の守護者のエフェクト,庭園の守護者が定期的に使用するスキルのエフェクト
401,回復の泉,回復の泉,回復の泉が初出現時に使用するスキル
402,回復の泉強化効果,回復の泉強化効果,回復の泉の周りではHPが素早く回復
403,要塞戦の復活強化効果,無敵,要塞戦で復活する際、一時的に無敵状態になる
451,攻城戦の守城側復活強化効果,無敵,攻城戦で復活する際、一時的に無敵状態になる
452,攻城戦の守城側復活強化効果,移動速度,攻城戦で復活する際、一時的に素早く移動できる
453,攻城戦の攻城側復活強化効果,無敵,攻城戦で復活する際、一時的に無敵状態になる
454,攻城戦の攻城側復活強化効果,移動速度,攻城戦で復活する際、一時的に素早く移動できる
501,PK防止,PK防止,PKされなくなる（攻城戦、要塞戦、戦場を除く）
502,PK防止,PK防止,PKされなくなる（攻城戦、要塞戦、戦場を除く）
503,PK防止,PK防止,PKされなくなる（攻城戦、要塞戦、戦場を除く）
510,アインハザードの加護,アインハザードの加護,フィールド討伐の経験値/採集経験値が+100%になる
511,アインハザードの加護,アインハザードの加護,フィールド討伐の経験値/採集経験値が+200%になる
720212,前足振り[スタン],スタン,気絶
1720212,前足振り[スタン],スタン,気絶
720222,毒吐き[毒],독,中毒して持続ダメージを受ける
1720222,毒吐き[毒],독,中毒して持続ダメージを受ける
720232,ホルモン噴出[物理防御力減少],物理防御力減少,物理防御力が減少
720233,ホルモン噴出[魔法防御力減少],魔法防御力減少,魔法防御力が減少
720234,ホルモン噴出[移動速度減少],移動速度減少,移動速度が減少
1720232,ホルモン噴出[物理防御力減少],物理防御力減少,物理防御力が減少
1720233,ホルモン噴出[魔法防御力減少],魔法防御力減少,魔法防御力が減少
1720234,ホルモン噴出[移動速度減少],移動速度減少,移動速度が減少
720241,土掘り[透明],透明,
720242,土掘り[無敵],無敵,
720243,土掘り[スタン],スタン,
720251,凶暴化（クイーンアント）,魔法攻撃力増加,
720282,通常攻撃+移動速度減少,基本クリティカルダメージ抵抗,移動速度が減少
720301,15秒間物理攻撃無効,,
721211,20秒間防御力増加,,
721222,クイーンアント通常攻撃強化,독,中毒して持続ダメージを受ける
7212411,働きアリ強化効果（演出用）,自爆までの残り時間,
721241,働きアリ強化効果{Param1},,
721242,働きアリ強化効果{Param1},,
721243,働きアリ強化効果{Param1},,
721244,働きアリ強化効果{Param1},,
721245,働きアリ強化効果{Param1},,
721246,働きアリ強化効果{Param1},,
721301,土掘り[スタン],スタン,
721321,拘束,,拘束され移動できなくなる
721332,子守アリ強化効果,,
721341,子守アリ自己強化効果,,
17200022,@4,,중독 되어 지속적으로 피해를 받습니다.
17200032,毒たまり,毒たまり,
17200033,転ぶ,,
17200052,スタン,,身体を動かせなくなる
17200091,凶暴化,,
720312,血の剣気：出血,出血,30秒間、重複する持続ダメージを与える
720321,血のバリア,バリア,10秒間維持されるバリア
720351,血の凶暴化,凶暴化,凶暴化
720352,血の凶暴化,凶暴化,凶暴化
720353,血の凶暴化（VERY HARD）,凶暴化,凶暴化
720372,スタン,バールカルロン：スタン,
7203721,スタン,バールカルロン（VERY HARD）：スタン,
720361,血の剣気：出血,出血2,30秒間、重複する持続ダメージを与える
72038,血の渦巻き：防御力減少,防御力減少,10秒間、重複する防御力減少効果が適用される
172035,バールカルロン分身：攻撃力の強化効果,攻撃力増加,攻撃力増加
720391,分身召喚：クールタイム,クールタイム,単純クールタイム
720441,グラビティポイズン,持続ダメージ,30秒間、持続ダメージを与える
720451,コア暴走,凶暴化,暴走
720461,精神支配,精神支配,混乱に陥り、敵と味方が区別できなくなる
720472,ドリル突き（スタン）,スタン,気絶
720482,門番の咆哮（沈黙）,沈黙,スキル使用不可
720511,EASY召喚{Param1},クールタイムテスト,単純クールタイム
720521,精神支配,精神支配,混乱に陥り、敵と味方が区別できなくなる
720531,精神支配,精神支配,混乱に陥り、敵と味方が区別できなくなる
720541,EASY召喚{Param1},クールタイムテスト,単純クールタイム
720551,NORMAL召喚{Param1},クールタイムテスト,単純クールタイム
720561,NORMAL召喚{Param1},クールタイムテスト,単純クールタイム
720571,NORMAL召喚{Param1},クールタイムテスト,単純クールタイム
720581,HARD召喚{Param1},クールタイムテスト,単純クールタイム
720591,HARD召喚{Param1},クールタイムテスト,単純クールタイム
720601,HARD召喚{Param1},クールタイムテスト,単純クールタイム
600,精神支配：テスト,精神支配,精神支配（現在のテストデータ）
741141,大地断裂,スタン,大地の断裂によりスタン状態に陥る
741171,マラックス-疲労困憊,スタン,"マラックスが疲労困憊し、
マラックスに与えるダメージ量が大幅に増加"
741191,悪魔のトーテム重複強化効果,重複強化効果,すべて重複するとスタン状態に陥る
7411911,マラックス-疲労困憊,スタン,マラックスが疲労困憊する
7411912,マラックス-ストロング,悪魔の免疫,悪魔の免疫によりダメージを受けない
601391,腐食,攻撃速度減少,攻撃速度が減少
601402,気が緩む,命中率減少,攻撃の命中率が減少
601412,出血,@21242,出血の持続ダメージを受ける
601441,出血,@21242,出血の持続ダメージを受ける
601462,スタン,スタン,気絶
601472,ノックダウン,ノックダウン,転ぶ
601612,ノックダウン,ノックダウン,転ぶ
601622,スロー,スロー,移動速度減少
601642,@4,中毒,毒の持続ダメージ
601,スタン,気絶,気絶
910245,有機蜂蜜キャンディ,,"攻撃力1,500増加"
910246,イチゴキャンディ,,"最大HP3,000増加"
910247,チョコキャンディ,,"最大MP3,000増加"
910248,ブドウキャンディ,,"防御力2,000増加"
910249,春のぬくもりを宿した新芽,,"防御力2,000増加"
910250,よくできました,,"攻撃力1,500増加"
910251,ブドウ,,クリティカルダメージ3％増加
910252,スイカ,,"最大HP3,000増加"
910253,マクワウリ,,"防御力2,000増加"
910254,トックリイチゴ,,"攻撃力1,500増加"
602,フィールドボスの演出用強化効果,フィールドボスの演出用,フィールドボスの演出用
800000,通知アイコン（テスト）,通知アイコン表示,通知アイコン表示テスト
805004,血の剣気：出血,貧血,30秒間、重複する持続ダメージを与える
411005,傷口,傷口,傷口から出血して防御力が減少
411010,アネミア,スタン,
411011,スナッチ,HP奪取,レオナードから血を奪われる
411018,トゥ・ビー・ワイルド,攻撃力増加、防御力減少,血の成分が吸血鬼化し、興奮する
411019,ヴァンパイア・ナイト,精神支配,完全に吸血鬼になって味方の血を狙う
411036,血の怒りⅠ,,
411037,血の怒りⅡ,,
411038,血の怒りⅢ,,
412005,傷口,傷口,傷口から出血して防御力が減少
412010,アネミア,スタン,
412011,スナッチ,HP奪取,レオナードから血を奪われる
412018,トゥ・ビー・ワイルド,攻撃力増加、防御力減少,血の成分が吸血鬼化し、興奮する
412019,ヴァンパイア・ナイト,精神支配,完全に吸血鬼になって味方の血を狙う
412036,血の怒りⅠ,,
412037,血の怒りⅡ,,
412038,血の怒りⅢ,,
413002,激怒する血,攻撃力、攻撃速度増加,
413005,傷口,傷口,傷口から出血して防御力が減少
413010,レオナード：貧血,スタン,
413011,スナッチ,HP奪取,レオナードから血を奪われる
413013,腐食性の酸,持続ダメージ、移動速度減少,粘液が粘ついて動きづらく、肌を溶かす
413016,コウモリ：透明,,
4130212,ブラッドチャージ：無敵,無敵,
4130213,ブラッドチャージ：スタン,スタン,
413018,トゥ・ビー・ワイルド,攻撃力増加、防御力減少,血の成分が吸血鬼化し、興奮する
413019,ヴァンパイア・ナイト,精神支配,完全に吸血鬼になって味方の血を狙う
4130272,血塊グロー,,
413034,粘液の飽和,,
413035,ザケンの幻影：無敵,無敵,ダメージを受けない
413036,血の怒りⅠ,,
413037,血の怒りⅡ,,
413038,血の怒りⅢ,,
413041,レオナード：血の地獄,スタン,
414002,激怒する血,攻撃力、攻撃速度増加,
414005,傷口,傷口,傷口から出血して防御力が減少
414010,アネミア,スタン,
414011,スナッチ,HP奪取,レオナードから血を奪われる
414013,腐食性の酸,持続ダメージ、移動速度減少,粘液が粘ついて動きづらく、肌を溶かす
414016,コウモリ：透明,,
414018,トゥ・ビー・ワイルド,攻撃力増加、防御力減少,血の成分が吸血鬼化し、興奮する
414019,ヴァンパイア・ナイト,精神支配,完全に吸血鬼になって味方の血を狙う
414036,血の怒りⅠ,,
414037,血の怒りⅡ,,
414038,血の怒りⅢ,,
414041,レオナード：血の地獄,スタン,
414043,ターク：透明強化効果,スタン,
414045,吸血鬼共鳴,,
4010062,岩砕き：スタン,スタン,気絶
4010202,ロックオン：的,的,斧を投げられる
401021,火種,,一定時間後に爆発して地面に火炎を作る
401026,発火,重複追加ダメージ,爆発時、とても大きな追加ダメージを受ける
401009,ラモグの親衛隊警備兵凶暴化,演出,
401010,オーク呪術師の魂：演出,,
401011,ネビュライトクリスタル：スタン,スタン,
401013,爆発タイマー,爆発まで残り,
401014,爆発演出用強化効果1,,
401015,爆発演出用強化効果2,,
4020012,切り付け：ノックダウン,ノックダウン,転ぶ
4010351,爆発待機：移動攻撃不可,ラモグ移動不可用,
4020101,爆発待機：移動不可,移動速度減少,
4010361,パアグリオ移動強化効果,移動用,
4010222,火炎,火炎,
401000,オークの力,オーク補給品強化効果,
4011032,ロックオン：スタン,ノックダウン,
4011042,火種,火種,火種が身体について持続ダメージを受ける
4011022,火種爆発1,火種,
4011023,火種爆発2,,
4011092,火種爆発：ノックダウン,ノックダウン,
4012022,火炎,,爆発時、とても大きな追加ダメージを受ける
4012051,爆発待機,,
4012061,パアグリオ移動強化効果,,
401217,凶暴化待機,,
401218,ラモグ自分にスタン,,
4012092,パアグリオグロー,,
401211,ラモグ：凶暴化,,
40020101,網拘束,移動不可,縄に捕縛されて動けません。
40020102,負傷悪化,防御力減少,斧で斬られ、以降の攻撃で受けるダメージが増えます。
40020103,大地の鎧,防御力増加,
